{
  "$schema": "https://json-schema.org/draft/2020-12/schema",
  "$id": "https://agentlens.dev/schemas/agentlens.final.v2.json",
  "$comment": "AgentRunway Trust Console final record.",
  "title": "agentlens.final.v2",
  "type": "object",
  "additionalProperties": false,
  "required": ["schema", "run_id", "ended_at", "claimed_outcome", "summary", "changed_files", "verification", "residual_risks"],
  "properties": {
    "schema": {"type": "string", "const": "agentlens.final.v2"},
    "run_id": {"type": "string"},
    "ended_at": {"type": "string", "pattern": "^\\d{4}-\\d{2}-\\d{2}T\\d{2}:\\d{2}:\\d{2}(\\.\\d+)?Z$"},
    "claimed_outcome": {"type": "string", "enum": ["success", "failed", "partial", "cancelled", "unknown"]},
    "summary": {"type": "string", "maxLength": 4096},
    "changed_files": {
      "type": "array",
      "items": {
        "type": "object",
        "additionalProperties": false,
        "required": ["path_label", "path_hash"],
        "properties": {
          "path_label": {"type": "string"},
          "path_hash": {"type": "string", "pattern": "^sha256:[a-f0-9]{64}$"}
        }
      }
    },
    "verification": {
      "type": "array",
      "items": {
        "type": "object",
        "additionalProperties": false,
        "required": ["kind", "command_hash", "status", "excerpt"],
        "properties": {
          "kind": {"type": "string", "enum": ["command", "test", "manual"]},
          "command_hash": {"type": "string", "pattern": "^sha256:[a-f0-9]{64}$"},
          "status": {"type": "string", "enum": ["passed", "failed", "skipped"]},
          "excerpt": {"type": "string", "maxLength": 4096}
        }
      }
    },
    "residual_risks": {"type": "array", "items": {"type": "object"}}
  }
}
